{
  "$schema": "https://json-schema.org/draft/2020-12/schema",
  "$id": "https://live-document.local/stage3/input-contract.schema.json",
  "title": "Stage 3 frozen input contract",
  "type": "object",
  "additionalProperties": false,
  "required": [
    "schema_version",
    "case_id",
    "case_definition",
    "program_source",
    "keyframes",
    "semantic_exports",
    "geometry_policy",
    "motion_contract",
    "visual_target_package",
    "hard_gates"
  ],
  "properties": {
    "schema_version": {"const": "1.0"},
    "case_id": {"type": "string", "minLength": 1},
    "case_definition": {"type": "object"},
    "program_source": {"type": "object"},
    "keyframes": {
      "type": "array",
      "minItems": 2,
      "items": {"type": "object"}
    },
    "semantic_exports": {
      "type": "object",
      "required": ["layer_types", "object_classes"]
    },
    "geometry_policy": {
      "enum": ["preserve_exact", "canonicalize", "layout_only", "unsupported"]
    },
    "motion_contract": {"type": "object"},
    "visual_target_package": {"type": "object"},
    "hard_gates": {
      "type": "array",
      "minItems": 1,
      "items": {"type": "string"}
    }
  }
}
