{
  "case_definition": {
    "capability_tags": [
      "exact_geometry",
      "trajectory_sync",
      "progressive_trace"
    ],
    "discipline": "mathematics",
    "discipline_zh": "数学",
    "slug": "unit_circle_sine",
    "title_zh": "单位圆怎样生成正弦曲线"
  },
  "case_id": "MATH-01",
  "geometry_policy": "preserve_exact",
  "hard_gates": [
    "curve_y_matches_circle_point_y",
    "one_rotation_equals_one_period",
    "trace_never_draws_future",
    "appearance_to_geometry_leakage"
  ],
  "keyframes": [
    {
      "annotated_program_frame": {
        "path": "modules/video_model/stage2/output/phase-4/programs/MATH-01/keyframes/00_start/program.png",
        "sha256": "323822fbe090ed66a92a5b1575c245ae09ffb3060aa9bcce373651084ee7e4d4",
        "size_bytes": 5722
      },
      "clean_program_frame": {
        "path": "modules/video_model/stage2/output/phase-4/programs/MATH-01/keyframes/00_start/clean.png",
        "sha256": "089801fe0b66908da512b81ae65270c0df68625776a9dc51ac6b0894dc3cb69e",
        "size_bytes": 3082
      },
      "keyframe_id": "00_start",
      "order": 0,
      "semantic_layers": {
        "path": "modules/video_model/stage2/output/phase-4/programs/MATH-01/keyframes/00_start/semantic_layers.json",
        "sha256": "bff241d766169d572a6a3917fc2084ca8d77daf63bf09ee81ba0334667e110fc",
        "size_bytes": 5186
      },
      "state": {
        "path": "modules/video_model/stage2/output/phase-4/programs/MATH-01/keyframes/00_start/state.json",
        "sha256": "d4be3e9d0d1bc91e6a7e78cfdeeac5d821e1adf0551c7e0b4ade8755203f71ed",
        "size_bytes": 246
      }
    },
    {
      "annotated_program_frame": {
        "path": "modules/video_model/stage2/output/phase-4/programs/MATH-01/keyframes/01_mechanism/program.png",
        "sha256": "151d495b7732507c51e2cab77c3272b9661cda1773dadc43e3d1b9158cbdb185",
        "size_bytes": 6863
      },
      "clean_program_frame": {
        "path": "modules/video_model/stage2/output/phase-4/programs/MATH-01/keyframes/01_mechanism/clean.png",
        "sha256": "da32da54a039109ca00f3edaab1a637e885a1e2772786f7c96bce2a9b577e30f",
        "size_bytes": 3726
      },
      "keyframe_id": "01_mechanism",
      "order": 1,
      "semantic_layers": {
        "path": "modules/video_model/stage2/output/phase-4/programs/MATH-01/keyframes/01_mechanism/semantic_layers.json",
        "sha256": "0946a38fb558dadf20d0b9cfdc3c6b7f82af396002fa4fbf210a3dee2e7ae75e",
        "size_bytes": 5222
      },
      "state": {
        "path": "modules/video_model/stage2/output/phase-4/programs/MATH-01/keyframes/01_mechanism/state.json",
        "sha256": "386b0b8470e907cf03918cc2bc5c1d24e79d1adf8946ad178224676e0edfacb7",
        "size_bytes": 282
      }
    },
    {
      "annotated_program_frame": {
        "path": "modules/video_model/stage2/output/phase-4/programs/MATH-01/keyframes/02_result/program.png",
        "sha256": "fbe9735334330250aa28dced07a963fb5a062b5260a252bf58b132a56f4dcbeb",
        "size_bytes": 6777
      },
      "clean_program_frame": {
        "path": "modules/video_model/stage2/output/phase-4/programs/MATH-01/keyframes/02_result/clean.png",
        "sha256": "a58253d5172a54228e5b93e412ab26ba2cc49503f665851d6c403243b433447a",
        "size_bytes": 4172
      },
      "keyframe_id": "02_result",
      "order": 2,
      "semantic_layers": {
        "path": "modules/video_model/stage2/output/phase-4/programs/MATH-01/keyframes/02_result/semantic_layers.json",
        "sha256": "abeaf008cf3e97a66385bdf48cecbcee464faddeeeb2b31dd860bcce3165f6f7",
        "size_bytes": 5195
      },
      "state": {
        "path": "modules/video_model/stage2/output/phase-4/programs/MATH-01/keyframes/02_result/state.json",
        "sha256": "bdae2cd5672a8f8f39cef79881f0e2470e8e0b16ea5496fcbc4d5b06039af773",
        "size_bytes": 286
      }
    },
    {
      "annotated_program_frame": {
        "path": "modules/video_model/stage2/output/phase-4/programs/MATH-01/keyframes/03_end/program.png",
        "sha256": "03ae27b2fd4b44a9e05a28381b310ef023d41cee121ffcf80d354d824e13986c",
        "size_bytes": 7328
      },
      "clean_program_frame": {
        "path": "modules/video_model/stage2/output/phase-4/programs/MATH-01/keyframes/03_end/clean.png",
        "sha256": "0d421e54a69a1fae62402c234d9b37f668d04f1823b404b64f644917c812be50",
        "size_bytes": 4341
      },
      "keyframe_id": "03_end",
      "order": 3,
      "semantic_layers": {
        "path": "modules/video_model/stage2/output/phase-4/programs/MATH-01/keyframes/03_end/semantic_layers.json",
        "sha256": "fdbf3468b39d40bd3a9592c7b8d2cd03e644223bf133e2e348b4e27c01245654",
        "size_bytes": 5168
      },
      "state": {
        "path": "modules/video_model/stage2/output/phase-4/programs/MATH-01/keyframes/03_end/state.json",
        "sha256": "7aefa0c889651d07d487f3192fc88b74a33f75e6a40cd0e4c64aaff152579223",
        "size_bytes": 255
      }
    }
  ],
  "motion_contract": {
    "path": "modules/video_model/stage3/motion_contracts/MATH-01.json",
    "sha256": "92034c1d972fee74b55dddb5ac510bdc29eed5aec0612e29fe2ed389b561dba0"
  },
  "program_source": {
    "concept_spec": {
      "path": "modules/video_model/stage2/output/phase-1/fixtures/MATH-01/concept_spec.json",
      "sha256": "3b83633af0f67c498a517aa60490359614af6b2dfb9e7bd2a9a383260ff6a7e9",
      "size_bytes": 1989
    },
    "program_manifest": {
      "path": "modules/video_model/stage2/output/phase-4/programs/MATH-01/program_manifest.json",
      "sha256": "2cd55a2c081cb1f189b2f5fcb315ee5787571f68aee02b4aa66f69b4a31500d0",
      "size_bytes": 38838
    },
    "root": "modules/video_model/stage2/output/phase-4/programs/MATH-01",
    "sequence_spec": {
      "path": "modules/video_model/stage2/output/phase-1/fixtures/MATH-01/sequence_spec.json",
      "sha256": "b2254146460d79498ecf742e4f82c98f2409cef39dc234b22515953f4cbcddb6",
      "size_bytes": 2879
    }
  },
  "schema_version": "1.0",
  "semantic_exports": {
    "control_object_requirements": [],
    "layer_ids": [
      "math-01_annotation",
      "math01_hard_boundary",
      "math01_paper_region",
      "math01_point_identity"
    ],
    "layer_types": [
      "annotation",
      "hard_boundary",
      "object_identity",
      "region"
    ],
    "object_classes": [
      "rotating_point",
      "sine_trace_head"
    ],
    "source_policy": "Exported directly from deterministic program state; not inferred from the rendered screenshot."
  },
  "visual_target_package": {
    "path": "modules/video_model/stage3/visual_targets/MATH-01/manifest.json",
    "status": "accepted_project_baseline"
  }
}
