{
  "case_definition": {
    "capability_tags": [
      "fixed_terrain",
      "coupled_fields",
      "hidden_variable"
    ],
    "discipline": "geography",
    "discipline_zh": "地理",
    "slug": "orographic_rain_shadow",
    "title_zh": "地形雨与背风坡雨影"
  },
  "case_id": "GEO-02",
  "geometry_policy": "layout_only",
  "hard_gates": [
    "terrain_is_fixed",
    "primary_rain_is_on_windward_side",
    "leeward_humidity_and_rainfall_decrease",
    "appearance_to_geometry_leakage"
  ],
  "keyframes": [
    {
      "annotated_program_frame": {
        "path": "modules/video_model/stage2/output/phase-2/GEO-02/keyframes/00_start/program.png",
        "sha256": "69ddebf62f1ae143890207653f5a35dfd189c96526ab2d409b7ef6c10ffba18f",
        "size_bytes": 13148
      },
      "clean_program_frame": {
        "path": "modules/video_model/stage2/output/phase-2/GEO-02/keyframes/00_start/clean.png",
        "sha256": "f35d917eda95881bb8d8ab3be24861156d5995b00439e7de8b834c709ea32473",
        "size_bytes": 10593
      },
      "keyframe_id": "00_start",
      "order": 0,
      "semantic_layers": {
        "path": "modules/video_model/stage2/output/phase-2/GEO-02/keyframes/00_start/semantic_layers.json",
        "sha256": "21824e4492ea9a45ec54227f2310d3a7c4637ba009ceb539607fb835c1e9d96a",
        "size_bytes": 7732
      },
      "state": {
        "path": "modules/video_model/stage2/output/phase-2/GEO-02/keyframes/00_start/state.json",
        "sha256": "56a1acaa841963019b04ab5db5a9e887306823bcd5896dd65ffc72d1bf0fa99c",
        "size_bytes": 291
      }
    },
    {
      "annotated_program_frame": {
        "path": "modules/video_model/stage2/output/phase-2/GEO-02/keyframes/01_mechanism/program.png",
        "sha256": "9c0c670d33eade30171913b5eec51bea188dca55a11d95f8b9095dcc4d4bd079",
        "size_bytes": 17570
      },
      "clean_program_frame": {
        "path": "modules/video_model/stage2/output/phase-2/GEO-02/keyframes/01_mechanism/clean.png",
        "sha256": "82e89cd8f21277a2a029ee688b416d61eaac223100e7c7bf6ef12771e59c83ca",
        "size_bytes": 14837
      },
      "keyframe_id": "01_mechanism",
      "order": 1,
      "semantic_layers": {
        "path": "modules/video_model/stage2/output/phase-2/GEO-02/keyframes/01_mechanism/semantic_layers.json",
        "sha256": "75b509c92d29c2227536e9920676f5e0bceadeeccb25d073097af66545f5617b",
        "size_bytes": 7784
      },
      "state": {
        "path": "modules/video_model/stage2/output/phase-2/GEO-02/keyframes/01_mechanism/state.json",
        "sha256": "2672ad8b7d836653d992d5d705fe2f75ea6844e35c7a56472dad5c0dd02b85af",
        "size_bytes": 302
      }
    },
    {
      "annotated_program_frame": {
        "path": "modules/video_model/stage2/output/phase-2/GEO-02/keyframes/02_result/program.png",
        "sha256": "f12ec4b4a36c4bd89742f08d421bc28e43d68f9deb137c4cd7d1f034e33e3242",
        "size_bytes": 17326
      },
      "clean_program_frame": {
        "path": "modules/video_model/stage2/output/phase-2/GEO-02/keyframes/02_result/clean.png",
        "sha256": "dabddc902f33c20af5c8d922e37a0a4f2763716b00aa6c6562ccc313c281ff25",
        "size_bytes": 14373
      },
      "keyframe_id": "02_result",
      "order": 2,
      "semantic_layers": {
        "path": "modules/video_model/stage2/output/phase-2/GEO-02/keyframes/02_result/semantic_layers.json",
        "sha256": "31ebc6f3c6244aaeef3191320db7f4212d31f38804379659739cbe7f5872f06b",
        "size_bytes": 7738
      },
      "state": {
        "path": "modules/video_model/stage2/output/phase-2/GEO-02/keyframes/02_result/state.json",
        "sha256": "7fbdc6e944178655c2e66e26e5725d79d25ea74812404889e3fc8b58e3f89fa6",
        "size_bytes": 299
      }
    },
    {
      "annotated_program_frame": {
        "path": "modules/video_model/stage2/output/phase-2/GEO-02/keyframes/03_end/program.png",
        "sha256": "72afbd497fb37ac093d004594dadd6e3729be6224914be06c4b9c15bd9875e2c",
        "size_bytes": 11818
      },
      "clean_program_frame": {
        "path": "modules/video_model/stage2/output/phase-2/GEO-02/keyframes/03_end/clean.png",
        "sha256": "630e664e4c692bf0d1349d7144b0fd3319ad4d5ade66672dcd7a1fb7a634d684",
        "size_bytes": 9113
      },
      "keyframe_id": "03_end",
      "order": 3,
      "semantic_layers": {
        "path": "modules/video_model/stage2/output/phase-2/GEO-02/keyframes/03_end/semantic_layers.json",
        "sha256": "c16ffc4838e57511d1cb9ebfc52d65c27c10b63c150bd0820f9d64346de7c915",
        "size_bytes": 7706
      },
      "state": {
        "path": "modules/video_model/stage2/output/phase-2/GEO-02/keyframes/03_end/state.json",
        "sha256": "bf477e5819a9fbbca055f31ff9fc3672ca4a39cc19c4147c4152077a0ea846a6",
        "size_bytes": 295
      }
    }
  ],
  "motion_contract": {
    "path": "modules/video_model/stage3/motion_contracts/GEO-02.json",
    "sha256": "fc9aeaca4d0ac812ce05a10254b32132841564ec760576a940d4b4da037c33ad"
  },
  "program_source": {
    "concept_spec": {
      "path": "modules/video_model/stage2/output/phase-1/fixtures/GEO-02/concept_spec.json",
      "sha256": "b617ce9863e269572d907504c7948fa1c3bdb0491860a6ebf6a82c74cc369735",
      "size_bytes": 1899
    },
    "program_manifest": {
      "path": "modules/video_model/stage2/output/phase-2/GEO-02/program_manifest.json",
      "sha256": "862253901c0d4248b022c3b77c5f8a9055035e2d750a3840bf398539143a7f4e",
      "size_bytes": 50910
    },
    "root": "modules/video_model/stage2/output/phase-2/GEO-02",
    "sequence_spec": {
      "path": "modules/video_model/stage2/output/phase-1/fixtures/GEO-02/sequence_spec.json",
      "sha256": "dfd2e9c83859b2790f67ff86acd486d4345530d46f0e1f74eebc2982b09a1d90",
      "size_bytes": 2803
    }
  },
  "schema_version": "1.0",
  "semantic_exports": {
    "control_object_requirements": [],
    "layer_ids": [
      "geo-02_annotation",
      "geo02_airflow",
      "geo02_humidity_cloud_rain",
      "geo02_parcel_identity",
      "geo02_terrain_height",
      "geo02_terrain_region"
    ],
    "layer_types": [
      "annotation",
      "height_or_normal",
      "object_identity",
      "region",
      "scalar_field",
      "vector_field"
    ],
    "object_classes": [
      "moving_air_parcel"
    ],
    "source_policy": "Exported directly from deterministic program state; not inferred from the rendered screenshot."
  },
  "visual_target_package": {
    "path": "modules/video_model/stage3/visual_targets/GEO-02/manifest.json",
    "status": "provisional"
  }
}
