{
  "case_definition": {
    "capability_tags": [
      "exact_geometry",
      "rigid_transform",
      "area_conservation"
    ],
    "discipline": "mathematics",
    "discipline_zh": "数学",
    "slug": "pythagorean_dissection",
    "title_zh": "勾股定理的拼图重排证明"
  },
  "case_id": "MATH-02",
  "geometry_policy": "preserve_exact",
  "hard_gates": [
    "exactly_four_congruent_triangles",
    "piece_area_is_constant",
    "remaining_areas_are_equal",
    "appearance_to_geometry_leakage"
  ],
  "keyframes": [
    {
      "annotated_program_frame": {
        "path": "modules/video_model/stage2/output/phase-2/MATH-02/keyframes/00_start/program.png",
        "sha256": "ad5ccba303ecae00c7ae9fc87f24c2e7aabed5f2208abb04d40066991befd908",
        "size_bytes": 5629
      },
      "clean_program_frame": {
        "path": "modules/video_model/stage2/output/phase-2/MATH-02/keyframes/00_start/clean.png",
        "sha256": "b44d9c9f70053f677831dd2eb5751857a675a5cb027368c5dd773d64c5ff68e3",
        "size_bytes": 3142
      },
      "keyframe_id": "00_start",
      "order": 0,
      "semantic_layers": {
        "path": "modules/video_model/stage2/output/phase-2/MATH-02/keyframes/00_start/semantic_layers.json",
        "sha256": "a1abed5a57ef323445184b3014de2f71979bc50b4017fdc06dcc3bb0033ad14d",
        "size_bytes": 6462
      },
      "state": {
        "path": "modules/video_model/stage2/output/phase-2/MATH-02/keyframes/00_start/state.json",
        "sha256": "4519f8b0d1a6315bd9877055a91a8e6d61685a42e03f814192b13a8190d53b6f",
        "size_bytes": 1855
      }
    },
    {
      "annotated_program_frame": {
        "path": "modules/video_model/stage2/output/phase-2/MATH-02/keyframes/01_mechanism/program.png",
        "sha256": "2e1043d199a3851a1f19e7d9237d1d8896300ca5886fc777eddc508511999e9f",
        "size_bytes": 4906
      },
      "clean_program_frame": {
        "path": "modules/video_model/stage2/output/phase-2/MATH-02/keyframes/01_mechanism/clean.png",
        "sha256": "6058892d6eef58b29cbd605a1564bcfb5aed20d9790b5e895923164f56bb723a",
        "size_bytes": 3002
      },
      "keyframe_id": "01_mechanism",
      "order": 1,
      "semantic_layers": {
        "path": "modules/video_model/stage2/output/phase-2/MATH-02/keyframes/01_mechanism/semantic_layers.json",
        "sha256": "f0b69a143390f7ffb063ac10252325d3a45cd6f639fee7b4f1f101bf996fcbe8",
        "size_bytes": 6506
      },
      "state": {
        "path": "modules/video_model/stage2/output/phase-2/MATH-02/keyframes/01_mechanism/state.json",
        "sha256": "568c555531bfdea2e2870f35d65c5148b14f151dcee54c34235fe4e0f5497dee",
        "size_bytes": 1865
      }
    },
    {
      "annotated_program_frame": {
        "path": "modules/video_model/stage2/output/phase-2/MATH-02/keyframes/02_result/program.png",
        "sha256": "0d1c876f89648644a7136a908f0a1c0fb931df0a4a810d9a677b81a4e40a52ee",
        "size_bytes": 5494
      },
      "clean_program_frame": {
        "path": "modules/video_model/stage2/output/phase-2/MATH-02/keyframes/02_result/clean.png",
        "sha256": "b44d9c9f70053f677831dd2eb5751857a675a5cb027368c5dd773d64c5ff68e3",
        "size_bytes": 3142
      },
      "keyframe_id": "02_result",
      "order": 2,
      "semantic_layers": {
        "path": "modules/video_model/stage2/output/phase-2/MATH-02/keyframes/02_result/semantic_layers.json",
        "sha256": "8fcadd483db8663f24dc3b9d172bb09aa847e4974368d9ce1af59901fd9883ed",
        "size_bytes": 6473
      },
      "state": {
        "path": "modules/video_model/stage2/output/phase-2/MATH-02/keyframes/02_result/state.json",
        "sha256": "783de67d850e921e32b2acbcebd435a2a6e6440e53b13a4a0f45ebb74886ec59",
        "size_bytes": 1867
      }
    },
    {
      "annotated_program_frame": {
        "path": "modules/video_model/stage2/output/phase-2/MATH-02/keyframes/03_end/program.png",
        "sha256": "c53573c92e30310bc8a410883995f60b75cf93d3fa390e1ea117da4c1a7e7c99",
        "size_bytes": 4669
      },
      "clean_program_frame": {
        "path": "modules/video_model/stage2/output/phase-2/MATH-02/keyframes/03_end/clean.png",
        "sha256": "1bb18f3c800e022ffc8646aa2886fa9d6251a25eeb23bb78483ebd4b2ab048cb",
        "size_bytes": 2314
      },
      "keyframe_id": "03_end",
      "order": 3,
      "semantic_layers": {
        "path": "modules/video_model/stage2/output/phase-2/MATH-02/keyframes/03_end/semantic_layers.json",
        "sha256": "aec5e81bd5cb90addf880db431c847f2613b7b5777839d6c628f2e908edcce9f",
        "size_bytes": 6440
      },
      "state": {
        "path": "modules/video_model/stage2/output/phase-2/MATH-02/keyframes/03_end/state.json",
        "sha256": "62503a1cbbdd6880e51758b806e963924798c174272f892ad31c0ee4a525819b",
        "size_bytes": 1864
      }
    }
  ],
  "motion_contract": {
    "path": "modules/video_model/stage3/motion_contracts/MATH-02.json",
    "sha256": "0b6b2c9d8e9ee574437440edd3029cf73ded35b4a4fd0f49afc0c0ede056230c"
  },
  "program_source": {
    "concept_spec": {
      "path": "modules/video_model/stage2/output/phase-1/fixtures/MATH-02/concept_spec.json",
      "sha256": "6d758b96110f53a5251b49a47c2252b4035914f5ce8a86ad95cc0d7623487d63",
      "size_bytes": 1939
    },
    "program_manifest": {
      "path": "modules/video_model/stage2/output/phase-2/MATH-02/program_manifest.json",
      "sha256": "2a2b3f6d27a10633f2a839523f2951cf83cee8b69959fe29a885592800ae8770",
      "size_bytes": 44810
    },
    "root": "modules/video_model/stage2/output/phase-2/MATH-02",
    "sequence_spec": {
      "path": "modules/video_model/stage2/output/phase-1/fixtures/MATH-02/sequence_spec.json",
      "sha256": "614d77a960a7d950ba61f425761995e405aa5b4b189c9c558a1de26c8cfbb80c",
      "size_bytes": 2865
    }
  },
  "schema_version": "1.0",
  "semantic_exports": {
    "control_object_requirements": [
      {
        "cardinality": 4,
        "class_id": "congruent_right_triangle",
        "source": "object_identity"
      }
    ],
    "layer_ids": [
      "math-02_annotation",
      "math02_hard_boundary",
      "math02_piece_identity",
      "math02_piece_region",
      "math02_remaining_region"
    ],
    "layer_types": [
      "annotation",
      "hard_boundary",
      "object_identity",
      "region"
    ],
    "object_classes": [
      "congruent_right_triangle"
    ],
    "source_policy": "Exported directly from deterministic program state; not inferred from the rendered screenshot."
  },
  "visual_target_package": {
    "path": "modules/video_model/stage3/visual_targets/MATH-02/manifest.json",
    "status": "accepted_project_baseline"
  }
}
